{
  "kind": "execution_lanes",
  "schema_version": 1,
  "description": "Feasible capacity-pool lane packing for every numbered PenniLogic implementation, design and QA ticket. Point offsets are planning-order units inside a sprint. Sprint 01 lanes are executable only after the unscheduled T-GOV-03 and infra#4 governance adoption closes.",
  "points_per_lane": 20,
  "items": [
    {
      "ref": "T-SCA-ADM-01",
      "sprint": "Sprint 01",
      "capacity_pool": "Engineering",
      "lane": 1,
      "start": 0,
      "end": 3,
      "estimate": 3
    },
    {
      "ref": "T-SCA-WEB-01",
      "sprint": "Sprint 01",
      "capacity_pool": "Engineering",
      "lane": 1,
      "start": 3,
      "end": 8,
      "estimate": 5
    },
    {
      "ref": "T-GOV-01",
      "sprint": "Sprint 01",
      "capacity_pool": "Engineering",
      "lane": 1,
      "start": 8,
      "end": 16,
      "estimate": 8
    },
    {
      "ref": "T-GOV-02",
      "sprint": "Sprint 01",
      "capacity_pool": "Engineering",
      "lane": 2,
      "start": 0,
      "end": 5,
      "estimate": 5
    },
    {
      "ref": "T-SCA-CON-01",
      "sprint": "Sprint 01",
      "capacity_pool": "Engineering",
      "lane": 2,
      "start": 5,
      "end": 10,
      "estimate": 5
    },
    {
      "ref": "T-SCA-AND-01",
      "sprint": "Sprint 01",
      "capacity_pool": "Engineering",
      "lane": 2,
      "start": 10,
      "end": 18,
      "estimate": 8
    },
    {
      "ref": "T-SCA-AIS-01",
      "sprint": "Sprint 01",
      "capacity_pool": "Engineering",
      "lane": 3,
      "start": 0,
      "end": 3,
      "estimate": 3
    },
    {
      "ref": "infra#2",
      "sprint": "Sprint 01",
      "capacity_pool": "Engineering",
      "lane": 3,
      "start": 3,
      "end": 8,
      "estimate": 5
    },
    {
      "ref": "T-SCA-API-01",
      "sprint": "Sprint 01",
      "capacity_pool": "Engineering",
      "lane": 3,
      "start": 8,
      "end": 16,
      "estimate": 8
    },
    {
      "ref": "T-UXR-01",
      "sprint": "Sprint 01",
      "capacity_pool": "Product Design and UX",
      "lane": 1,
      "start": 0,
      "end": 5,
      "estimate": 5
    },
    {
      "ref": "T-UX-01",
      "sprint": "Sprint 01",
      "capacity_pool": "Product Design and UX",
      "lane": 1,
      "start": 5,
      "end": 8,
      "estimate": 3
    },
    {
      "ref": "T-RES-01",
      "sprint": "Sprint 01",
      "capacity_pool": "Product Design and UX",
      "lane": 2,
      "start": 0,
      "end": 5,
      "estimate": 5
    },
    {
      "ref": "T-UXR-02",
      "sprint": "Sprint 01",
      "capacity_pool": "Product Design and UX",
      "lane": 2,
      "start": 5,
      "end": 10,
      "estimate": 5
    },
    {
      "ref": "T-QA-07",
      "sprint": "Sprint 01",
      "capacity_pool": "Quality Assurance",
      "lane": 1,
      "start": 0,
      "end": 3,
      "estimate": 3
    },
    {
      "ref": "docs#21",
      "sprint": "Sprint 02",
      "capacity_pool": "Engineering",
      "lane": 1,
      "start": 0,
      "end": 5,
      "estimate": 5
    },
    {
      "ref": "T-ADR-ADMIN-06",
      "sprint": "Sprint 02",
      "capacity_pool": "Engineering",
      "lane": 1,
      "start": 5,
      "end": 10,
      "estimate": 5
    },
    {
      "ref": "infra#1",
      "sprint": "Sprint 02",
      "capacity_pool": "Engineering",
      "lane": 1,
      "start": 10,
      "end": 18,
      "estimate": 8
    },
    {
      "ref": "T-SCA-INF-01",
      "sprint": "Sprint 02",
      "capacity_pool": "Engineering",
      "lane": 2,
      "start": 0,
      "end": 8,
      "estimate": 8
    },
    {
      "ref": "T-ADR-MONEY-01",
      "sprint": "Sprint 02",
      "capacity_pool": "Engineering",
      "lane": 2,
      "start": 8,
      "end": 13,
      "estimate": 5
    },
    {
      "ref": "T-ADR-AIEGRESS-08",
      "sprint": "Sprint 02",
      "capacity_pool": "Engineering",
      "lane": 2,
      "start": 13,
      "end": 18,
      "estimate": 5
    },
    {
      "ref": "T-ADR-INDEX-10",
      "sprint": "Sprint 02",
      "capacity_pool": "Engineering",
      "lane": 3,
      "start": 0,
      "end": 3,
      "estimate": 3
    },
    {
      "ref": "T-ADR-AUTH-05",
      "sprint": "Sprint 02",
      "capacity_pool": "Engineering",
      "lane": 3,
      "start": 3,
      "end": 11,
      "estimate": 8
    },
    {
      "ref": "T-ADR-CRYPTO-04",
      "sprint": "Sprint 02",
      "capacity_pool": "Engineering",
      "lane": 3,
      "start": 11,
      "end": 19,
      "estimate": 8
    },
    {
      "ref": "T-UXR-03",
      "sprint": "Sprint 02",
      "capacity_pool": "Product Design and UX",
      "lane": 1,
      "start": 0,
      "end": 8,
      "estimate": 8
    },
    {
      "ref": "T-UXR-08",
      "sprint": "Sprint 02",
      "capacity_pool": "Product Design and UX",
      "lane": 1,
      "start": 8,
      "end": 13,
      "estimate": 5
    },
    {
      "ref": "T-UXR-07",
      "sprint": "Sprint 02",
      "capacity_pool": "Product Design and UX",
      "lane": 2,
      "start": 8,
      "end": 16,
      "estimate": 8
    },
    {
      "ref": "T-CNT-01",
      "sprint": "Sprint 02",
      "capacity_pool": "Product Design and UX",
      "lane": 3,
      "start": 8,
      "end": 16,
      "estimate": 8
    },
    {
      "ref": "T-QA-14",
      "sprint": "Sprint 02",
      "capacity_pool": "Quality Assurance",
      "lane": 1,
      "start": 0,
      "end": 3,
      "estimate": 3
    },
    {
      "ref": "T-ADR-LEDGER-03",
      "sprint": "Sprint 03",
      "capacity_pool": "Engineering",
      "lane": 1,
      "start": 0,
      "end": 8,
      "estimate": 8
    },
    {
      "ref": "T-ADR-CAT-02",
      "sprint": "Sprint 03",
      "capacity_pool": "Engineering",
      "lane": 1,
      "start": 8,
      "end": 13,
      "estimate": 5
    },
    {
      "ref": "api#1",
      "sprint": "Sprint 03",
      "capacity_pool": "Engineering",
      "lane": 1,
      "start": 13,
      "end": 18,
      "estimate": 5
    },
    {
      "ref": "infra#3",
      "sprint": "Sprint 03",
      "capacity_pool": "Engineering",
      "lane": 2,
      "start": 0,
      "end": 5,
      "estimate": 5
    },
    {
      "ref": "contracts#1",
      "sprint": "Sprint 03",
      "capacity_pool": "Engineering",
      "lane": 2,
      "start": 5,
      "end": 13,
      "estimate": 8
    },
    {
      "ref": "T-MIG-01",
      "sprint": "Sprint 03",
      "capacity_pool": "Engineering",
      "lane": 3,
      "start": 0,
      "end": 5,
      "estimate": 5
    },
    {
      "ref": "T-GOV-04",
      "sprint": "Sprint 03",
      "capacity_pool": "Engineering",
      "lane": 3,
      "start": 5,
      "end": 13,
      "estimate": 8
    },
    {
      "ref": "T-DSY-01",
      "sprint": "Sprint 03",
      "capacity_pool": "Product Design and UX",
      "lane": 1,
      "start": 0,
      "end": 5,
      "estimate": 5
    },
    {
      "ref": "T-DSY-04",
      "sprint": "Sprint 03",
      "capacity_pool": "Product Design and UX",
      "lane": 1,
      "start": 5,
      "end": 13,
      "estimate": 8
    },
    {
      "ref": "T-CNT-02",
      "sprint": "Sprint 03",
      "capacity_pool": "Product Design and UX",
      "lane": 1,
      "start": 13,
      "end": 18,
      "estimate": 5
    },
    {
      "ref": "T-DSY-02",
      "sprint": "Sprint 03",
      "capacity_pool": "Product Design and UX",
      "lane": 2,
      "start": 0,
      "end": 5,
      "estimate": 5
    },
    {
      "ref": "T-DSY-06",
      "sprint": "Sprint 03",
      "capacity_pool": "Product Design and UX",
      "lane": 2,
      "start": 5,
      "end": 13,
      "estimate": 8
    },
    {
      "ref": "T-UXR-04",
      "sprint": "Sprint 03",
      "capacity_pool": "Product Design and UX",
      "lane": 3,
      "start": 0,
      "end": 8,
      "estimate": 8
    },
    {
      "ref": "T-UXR-05",
      "sprint": "Sprint 03",
      "capacity_pool": "Product Design and UX",
      "lane": 3,
      "start": 8,
      "end": 16,
      "estimate": 8
    },
    {
      "ref": "T-DSY-07",
      "sprint": "Sprint 03",
      "capacity_pool": "Product Design and UX",
      "lane": 4,
      "start": 5,
      "end": 13,
      "estimate": 8
    },
    {
      "ref": "T-DSY-05",
      "sprint": "Sprint 03",
      "capacity_pool": "Product Design and UX",
      "lane": 5,
      "start": 5,
      "end": 13,
      "estimate": 8
    },
    {
      "ref": "T-DSY-03",
      "sprint": "Sprint 03",
      "capacity_pool": "Product Design and UX",
      "lane": 6,
      "start": 5,
      "end": 13,
      "estimate": 8
    },
    {
      "ref": "T-QA-04",
      "sprint": "Sprint 03",
      "capacity_pool": "Quality Assurance",
      "lane": 1,
      "start": 5,
      "end": 13,
      "estimate": 8
    },
    {
      "ref": "T-CON-12",
      "sprint": "Sprint 04",
      "capacity_pool": "Engineering",
      "lane": 1,
      "start": 0,
      "end": 5,
      "estimate": 5
    },
    {
      "ref": "T-CON-07",
      "sprint": "Sprint 04",
      "capacity_pool": "Engineering",
      "lane": 1,
      "start": 5,
      "end": 8,
      "estimate": 3
    },
    {
      "ref": "T-CON-01",
      "sprint": "Sprint 04",
      "capacity_pool": "Engineering",
      "lane": 1,
      "start": 8,
      "end": 16,
      "estimate": 8
    },
    {
      "ref": "api#2",
      "sprint": "Sprint 04",
      "capacity_pool": "Engineering",
      "lane": 2,
      "start": 0,
      "end": 13,
      "estimate": 13
    },
    {
      "ref": "api#3",
      "sprint": "Sprint 04",
      "capacity_pool": "Engineering",
      "lane": 2,
      "start": 13,
      "end": 18,
      "estimate": 5
    },
    {
      "ref": "T-PLT-01",
      "sprint": "Sprint 04",
      "capacity_pool": "Engineering",
      "lane": 3,
      "start": 0,
      "end": 13,
      "estimate": 13
    },
    {
      "ref": "T-UXR-06",
      "sprint": "Sprint 04",
      "capacity_pool": "Product Design and UX",
      "lane": 1,
      "start": 0,
      "end": 5,